<?xml version="1.0" encoding="UTF-8"?>
<xsd:schema xmlns:xsd="http://www.w3.org/2001/XMLSchema">
<xsd:element name="heros" type="Heros"/>
<xsd:complexType name="Heros">
    <xsd:sequence>
        <xsd:element name="powers" type="Powers" minOccurs="1"/>
        <xsd:element name="hero" type="Hero" maxOccurs="unbounded"/>
    </xsd:sequence>
</xsd:complexType>
<xsd:complexType name="Powers">
    <xsd:sequence>
        <xsd:element name="power" type="Power" minOccurs="1" maxOccurs="unbounded"/>
    </xsd:sequence>
</xsd:complexType>
<xsd:complexType name="Hero">
    <xsd:sequence>
        <xsd:element name="identity" type="Identity"/>
        <xsd:element name="species" type="xsd:string"/>
        <xsd:element name="abilities" type="xsd:string"/>
        <xsd:element name="movies" type="Movies"/>
    </xsd:sequence>
    <xsd:attribute name="id" type="xsd:string"/>
    <xsd:attribute name="birth-year" type="xsd:gYear"/>
</xsd:complexType>
<xsd:complexType name="Power">
    <xsd:simpleContent>
        <xsd:extension base="xsd:string">
            <xsd:attribute name="id" type="xsd:string"/>
        </xsd:extension>
    </xsd:simpleContent>
</xsd:complexType>
<xsd:complexType name="Identity">
    <xsd:sequence>
        <xsd:element name="firstname" type="xsd:string" maxOccurs="unbounded" minOccurs="1"/>
        <xsd:element name="lastname" type="xsd:string" maxOccurs="1" minOccurs="1"/>
        <xsd:choice>
            <xsd:element name="aliases" type="Aliases"/>
            <xsd:element name="alias" type="xsd:string" maxOccurs="unbounded"/>
        </xsd:choice>
    </xsd:sequence>
    <xsd:attribute name="height" type="Height"/>
    <xsd:attribute name="genre" type="Genre"/>
</xsd:complexType>
<xsd:complexType name="Aliases">
    <xsd:sequence>
        <xsd:element name="alias" type="xsd:string" maxOccurs="unbounded"/>
    </xsd:sequence>
</xsd:complexType>
<xsd:simpleType name="Genre">
    <xsd:restriction base="xsd:string">
       <xsd:enumeration value="F"/>
       <xsd:enumeration value="M"/>
       <xsd:enumeration value="NA"/>
    </xsd:restriction>
</xsd:simpleType>
<xsd:simpleType name="Movies">
    <xsd:restriction base="xsd:string">
        <xsd:pattern value="([a-zA-Z0-9_]+\[[0-9]{4}\]\s?)+"/>
    </xsd:restriction>
</xsd:simpleType>
<xsd:simpleType name="Height">
    <xsd:restriction base="xsd:decimal">
        <xsd:pattern value="[0-9]{1}.[0-9]{2}"/>
    </xsd:restriction>
</xsd:simpleType>
</xsd:schema>